firstletter,lastname,Shared Dept,Shared Div,authorID.x,affls.x,name.x,name_id.x,firstname.x,fullname.x,initials.x,FirstSearch.x,LastSearch.x,First.x,Last.x,Email.x,PositionTitle.x,Type.x,InUSCDirectory.x,firstlast.x,onlyfirst.x,loweronlyfirst.x,lowerlast.x,firstnameissues.x,authorID.y,affls.y,name.y,name_id.y,firstname.y,fullname.y,initials.y,FirstSearch.y,LastSearch.y,First.y,Last.y,Email.y,PositionTitle.y,Type.y,InUSCDirectory.y,firstlast.y,onlyfirst.y,loweronlyfirst.y,lowerlast.y,n_id,authorIDs,Combine (TRUE_FALSE)
A,Lee,Medicine,Keck Medicine of USC,57217164257,"Lee A., Division of Endocrinology and Diabetes, Keck School of Medicine, University of Southern California, Los Angeles, 90033, CA, United States",Lee A.,"Lee, A. (57217164257)",A.,"Lee, A.",,,,,,,,,NA,a lee,A,a,lee,TRUE,57215776558,"Lee A., Department of Medicine, Division of Gastroenterology, University of Southern California Keck School of Medicine, Los Angeles, CA, United States;Lee A., Division of Gastrointestinal and Liver Diseases, Keck School of Medicine of the University of Southern California, Los Angeles, CA, United States;Lee A., Department of Internal Medicine, Division of Gastroenterology, University of Southern California Keck School of Medicine, Los Angeles, CA, United States, Center for Center for Pancreatic Disease, Brigham and Women's Hospital, Harvard Medical School, Boston, MA, United States, Center for Pancreatic Disease, Brigham and Women's Hospital, Harvard Medical School, Boston, MA, United States",Lee A.,"Lee, Alice (57215776558)",Alice,"Lee, Alice",,,,,,,,,NA,alice lee,Alice,alice,lee,1,57215776558;57217164257,FALSE
A,Peters,Medicine,Keck Medicine of USC,7402105843,"Peters A.L., Keck School of Medicine of the University of Southern California, Los Angeles, CA, United States;Peters A.L., Keck School of Medicine of the University of Southern California, Los Angeles, CA, United States;Peters A., Keck School of Medicine, University of Southern California, Los Angeles, CA, United States;Peters A., Keck School of Medicine, University of Southern California, Los Angeles, United States;Peters A.L., Keck School of Medicine of the University of Southern California, Los Angeles, CA, United States;Peters A.L., Department of Clinical Medicine, Keck School of Medicine of the University of Southern California, 150 N. Robertson Boulevard, Beverly Hills, 90211, CA, United States;Peters A.L., Keck School of Medicine of the University of Southern California, Los Angeles, CA, United States;Peters A.L., Keck School of Medicine of the University of Southern California, Los Angeles, CA, United States;Peters A., Keck School of Medicine, University of Southern California, Los Angeles, CA, United States, Keck School of Medicine, University of Southern, California, Los Angeles, CA, United States;Peters A.L., Keck School of Medicine of the University of Southern California, Los Angeles, CA, United States;Peters A.L., Keck School of Medicine of the University of Southern California, Los Angeles, CA, United States;Peters A., Department of Medicine, University of Southern California, Los Angeles, CA, United States;Peters A.L., Keck School of Medicine, University of Southern California, Los Angeles, CA, United States;Peters A.L., Keck School of Medicine of the University of Southern California, Los Angeles, CA, United States;Peters A.L., Keck School of Medicine of USC, Los Angeles, CA, United States;Peters A.L., Keck School of Medicine of the University of Southern California, Los Angeles, CA, United States;Peters A.L., Keck School of Medicine of USC, Los Angeles, CA, United States;Peters A., Keck School of Medicine, University of Southern California, Los Angeles, CA, United States;Peters A., Keck School of Medicine, University of Southern California, Los Angeles, CA, United States;Peters A.L., Keck School of Medicine, University of Southern California, Los Angeles, United States;Peters A.L., Keck School of Medicine of the University of Southern California, Los Angeles, CA, United States;Peters A., Keck School of Medicine of the University of Southern California, Los Angeles, CA, United States;Peters A.L., Department of Medicine, Keck School of Medicine of the University of Southern California, Los Angeles, CA, United States;Peters A.L., Keck School of Medicine of the University of Southern California, Los Angeles, CA, United States;Peters A.L., University of Southern California, Los Angeles, CA, United States;Peters A.L., Keck School of Medicine, University of Southern California, Los Angeles, CA, United States;Peters A.L., Department of Medicine, Keck School of Medicine of the University of Southern California, Los Angeles, CA, United States;Peters A.L., Division of Endocrinology, Keck School of Medicine of the University of Southern California, Los Angeles, CA, United States;Peters A., Keck School of Medicine, University of Southern California, Los Angeles, CA, United States;Peters A.L., Keck School of Medicine, University of Southern California, Los Angeles, CA, United States;Peters A.L., University of Southern California, Los Angeles, CA, United States;Peters A.L., Keck School of Medicine of the University of Southern California, Los Angeles, CA, United States;University of Southern California",Peters A.L.,"Peters, A.L. (7402105843)",A.L.,"Peters, A.L.",,,,,,,,,NA,a l peters,A L,a l,peters,TRUE,57203513560,"Peters A., Keck School of Medicine of the University of Southern California, Los Angeles, Mexico;Peters A., Department of Medicine, Keck School of Medicine, University of Southern California, Los Angeles, CA, United States;Peters A., Department of Medicine, Keck School of Medicine, University of Southern California, Los Angeles, CA, USA;Peters A., Division of Endocrinology, University of Southern California, Los Angeles, CA, United States;Peters A., University of Southern California, Los Angeles, CA, United States;Peters A., Department of Medicine, Keck School of Medicine, University of Southern California, Los Angeles, CA, United States;Peters A., Keck School of Medicine of the University of Southern California, Los Angeles, CA, United States",Peters A.,"Peters, Anne (57203513560)",Anne,"Peters, Anne",,,,,,,,,NA,anne peters,Anne,anne,peters,1,57203513560;7402105843,TRUE
B,Verheijen,Other,Leonard Davis School of Gerontology,57768406400,"Verheijen B.M., University of Southern California, School of Gerontology, Los Angeles, 90089, CA, United States",Verheijen B.M.,"Verheijen, B.M. (57768406400)",B.M.,"Verheijen, B.M.",,B.M.,Verheijen,,,,,,FALSE,b m verheijen,B M,b m,verheijen,TRUE,56595230400,"Verheijen B.M., University of Southern California, Leonard Davis School of Gerontology, Los Angeles, 90089, CA, United States;Verheijen B.M., School of Gerontology, University of Southern California, Los Angeles, CA, United States;Verheijen B.M., Leonard Davis School of Gerontology, University of Southern California, Los Angeles, 90089, CA, United States",Verheijen B.M.,"Verheijen, Bert M. (56595230400)",Bert M.,"Verheijen, Bert M.",NA,NA,NA,NA,NA,NA,NA,NA,NA,bert m verheijen,Bert,bert,verheijen,1,56595230400;57768406400,TRUE
